{
  "$schema": "http://json-schema.org/draft-07/schema#",
  "$id": "thermal_health.schema.json",
  "title": "THERMAL_ANALYSIS",
  "description": "Thermal sensor data and short thermal-response test written by m09_thermal_health. Log glob: logs/thermal_health_*.json",
  "type": "object",
  "required": ["timestamp", "verdict", "warnings", "recommendations", "temperatures", "fans", "thermal_zones", "sensors_available"],
  "additionalProperties": true,
  "properties": {
    "timestamp":       { "type": "string", "description": "strftime %Y%m%d_%H%M%S (not ISO)" },
    "verdict":         { "type": "string", "enum": ["HEALTHY", "WARM", "HOT", "CRITICAL", "GOOD", "FAIR", "POOR", "UNKNOWN"] },
    "warnings":        { "type": "array", "items": { "type": "string" } },
    "recommendations": { "type": "array", "items": { "type": "string" } },
    "sensors_available": { "type": "boolean" },
    "temperatures": {
      "type": "array",
      "items": {
        "type": "object",
        "additionalProperties": true,
        "properties": {
          "source":         { "type": "string" },
          "chip":           { "type": "string" },
          "label":          { "type": "string" },
          "kind":           { "type": "string" },
          "value_c":        { "type": "number" },
          "crit_c":         { "type": ["number", "null"] },
          "max_c":          { "type": ["number", "null"] },
          "category":       { "type": "string", "examples": ["CPU", "GPU", "Disk", "Sensor"] },
          "severity":       { "type": "string", "examples": ["ok", "warn", "critical"] },
          "warn_threshold": {},
          "crit_threshold": {}
        }
      }
    },
    "fans": {
      "type": "array",
      "items": {
        "type": "object",
        "additionalProperties": true,
        "properties": {
          "source": { "type": "string" },
          "chip":   { "type": "string" },
          "label":  { "type": "string" },
          "kind":   { "type": "string" },
          "rpm":    { "type": "integer" }
        }
      }
    },
    "thermal_zones": {
      "type": "array",
      "items": {
        "type": "object",
        "additionalProperties": true,
        "properties": {
          "source":  { "type": "string" },
          "zone":    { "type": "string" },
          "type":    { "type": "string" },
          "value_c": { "type": "number" },
          "policy":  { "type": "string" }
        }
      }
    },
    "cpu_throttle": {
      "type": "object",
      "additionalProperties": true,
      "properties": {
        "governor":        { "type": "string" },
        "cur_mhz":         { "type": "integer" },
        "max_mhz":         { "type": "integer" },
        "throttled":       { "type": "boolean" },
        "cpuinfo_mhz_min": { "type": "integer" },
        "cpuinfo_mhz_max": { "type": "integer" }
      }
    },
    "report_type": {
      "type": "string",
      "enum": ["THERMAL_ANALYSIS"],
      "description": "Report type discriminator. Present in v2+ logs."
    },
    "idle_snapshot": {
      "type": "object",
      "additionalProperties": true,
      "description": "Passive thermal snapshot taken at idle (no load applied)",
      "properties": {
        "timestamp":        { "type": "string" },
        "duration_seconds": { "type": "number" },
        "idle_temp_c": {
          "type": ["number", "null"],
          "description": "CPU/package temperature at idle (°C)"
        },
        "hottest_sensor_c": { "type": ["number", "null"] },
        "hottest_sensor_label": { "type": ["string", "null"] },
        "cpu_freq_mhz":     { "type": ["integer", "null"], "description": "CPU frequency observed during idle snapshot" },
        "throttling_detected": { "type": ["boolean", "null"] }
      }
    },
    "thermal_response_test": {
      "type": "object",
      "additionalProperties": true,
      "description": "Short thermal response test: brief CPU load applied; measures heat rise, throttle response, and recovery",
      "properties": {
        "performed":            { "type": "boolean", "description": "Whether the test was actually run (may be skipped if sensors unavailable or emergency stop triggered)" },
        "skipped_reason":       { "type": ["string", "null"], "description": "Reason test was skipped, if applicable" },
        "load_duration_seconds":{ "type": "number" },
        "idle_temp_c":          { "type": ["number", "null"], "description": "Temperature immediately before load was applied (°C)" },
        "peak_temp_c":          { "type": ["number", "null"], "description": "Maximum temperature observed during load (°C)" },
        "temp_rise_c":          { "type": ["number", "null"], "description": "peak_temp_c − idle_temp_c (°C)" },
        "time_to_peak_seconds": { "type": ["number", "null"], "description": "Seconds from load start to peak temperature" },
        "recovery_temp_c":      { "type": ["number", "null"], "description": "Temperature after a recovery wait period (°C)" },
        "recovery_time_seconds":{ "type": ["number", "null"], "description": "Seconds from load end until temperature fell below idle + 5 °C (or recovery_temp_c was sampled)" },
        "cpu_freq_before_mhz":  { "type": ["integer", "null"], "description": "CPU frequency immediately before load" },
        "cpu_freq_during_mhz":  { "type": ["integer", "null"], "description": "CPU frequency at peak load (throttling evidence)" },
        "cpu_freq_after_mhz":   { "type": ["integer", "null"], "description": "CPU frequency after recovery" },
        "throttling_detected":  { "type": ["boolean", "null"], "description": "True if cpu_freq_during < cpu_freq_before by more than threshold" },
        "emergency_stop":       { "type": ["boolean", "null"], "description": "True if test was aborted because temperature exceeded emergency threshold" },
        "emergency_stop_temp_c":{ "type": ["number", "null"] },
        "confidence": {
          "type": "string",
          "enum": ["high", "medium", "low", "unknown"],
          "description": "Confidence in thermal response data quality"
        },
        "limitations": {
          "type": "array",
          "items": { "type": "string" },
          "description": "Caveats on test accuracy (e.g. live OS interference, short duration, single-core load only)"
        },
        "recommendations": {
          "type": "array",
          "items": { "type": "string" },
          "description": "Thermal-response-specific follow-up actions (e.g. clean heatsink, reapply thermal paste)"
        }
      }
    },
    "passive_verdict": {
      "type": ["string", "null"],
      "enum": ["HEALTHY", "WARM", "HOT", "CRITICAL", "POOR", "UNKNOWN", null],
      "description": "Verdict based on idle/passive sensor readings only (no load test). Maps to the top-level 'verdict' field when no active test was run."
    },
    "response_verdict": {
      "type": ["string", "null"],
      "enum": ["GOOD", "FAIR", "POOR", "CRITICAL", "SKIPPED", "UNKNOWN", null],
      "description": "Verdict based on the active thermal response test. SKIPPED when the test was not performed (sensors unavailable, already too hot, emergency stop triggered before test started)."
    },
    "overall_thermal_verdict": {
      "type": ["string", "null"],
      "enum": ["GOOD", "FAIR", "POOR", "CRITICAL", "UNKNOWN", null],
      "description": "Combined verdict considering both passive state and active response. Prefer this field for report generation. UNKNOWN when neither passive nor active data was available."
    },
    "response_confidence": {
      "type": ["string", "null"],
      "enum": ["high", "medium", "low", "unknown", "none", null],
      "description": "Confidence in the response_verdict. 'low' or 'unknown' when sensors are missing, the test was skipped, or when RescueZilla/Linux thermal behaviour may differ from OEM firmware behaviour under Windows."
    },
    "response_limitations": {
      "type": "array",
      "items": { "type": "string" },
      "description": "Limitations of the active response test — e.g. 'test_skipped_no_sensors', 'single_core_load_only', 'live_linux_may_differ_from_windows_thermal_policy', 'uefi_thermal_management_not_observable_from_os'"
    },
    "generated": {
      "type": ["string", "null"],
      "description": "ISO-8601 timestamp (preferred over timestamp for new logs)"
    },
    "source_module": {
      "type": ["string", "null"],
      "description": "Module that wrote this log (e.g. m09_thermal_health)"
    },
    "interpretation": {
      "type": "object",
      "additionalProperties": true,
      "description": "Report-facing interpretation block for explanation generation",
      "properties": {
        "customer_summary":   { "type": ["string", "null"] },
        "technician_summary": { "type": ["string", "null"] },
        "what_this_means":    { "type": ["string", "null"] },
        "confidence":         { "type": ["string", "null"], "enum": ["high", "medium", "low", "unknown", "none", null] },
        "limitations":        { "type": "array", "items": { "type": "string" } },
        "recommended_action": { "type": ["string", "null"] }
      }
    }
  }
}
